{"authority_scope":{"model_endorsement":false,"promotion":false,"provider_identity_attestation":false,"publication":false,"ranking":false,"regulatory_or_legal_approval":false,"release":false},"closed_by":{"action":"mechanical_cohort_closure","authority_type":"declared_human_operator","identity":"Matthew Neal"},"closure_id":"closure-openai-gpt56-memory-boundary-replication-r1-2026-07","closure_record_sha256":"ef519dc8cafb2cfa60eba183aa618770767f0fc3f662971876f5fce2117566fb","cohort":{"classification":"post_pilot_preregistered_repeated_execution_replication","cohort_id":"openai-gpt56-memory-boundary-replication-r1","member_count":30},"created_at":"2026-07-20T20:43:24+00:00","descriptive_summary":{"failure_mode_counts":{"state_loss":20},"result_hash_groups":[{"execution_ids":["openai-gpt56-sol-replication-r1-001","openai-gpt56-luna-replication-r1-001","openai-gpt56-luna-replication-r1-002","openai-gpt56-luna-replication-r1-003","openai-gpt56-sol-replication-r1-006","openai-gpt56-luna-replication-r1-008","openai-gpt56-sol-replication-r1-008","openai-gpt56-sol-replication-r1-009","openai-gpt56-sol-replication-r1-010","openai-gpt56-luna-replication-r1-010"],"result_hash":"3b0b0c5a1301d9a1a75b69b8ccbcb7f7427d954450cacb8f53d8337d038c7c4c"},{"execution_ids":["openai-gpt56-terra-replication-r1-001","openai-gpt56-terra-replication-r1-002","openai-gpt56-sol-replication-r1-002","openai-gpt56-sol-replication-r1-003","openai-gpt56-terra-replication-r1-003","openai-gpt56-sol-replication-r1-004","openai-gpt56-luna-replication-r1-004","openai-gpt56-terra-replication-r1-004","openai-gpt56-luna-replication-r1-005","openai-gpt56-terra-replication-r1-005","openai-gpt56-sol-replication-r1-005","openai-gpt56-terra-replication-r1-006","openai-gpt56-luna-replication-r1-006","openai-gpt56-sol-replication-r1-007","openai-gpt56-terra-replication-r1-007","openai-gpt56-luna-replication-r1-007","openai-gpt56-terra-replication-r1-008","openai-gpt56-luna-replication-r1-009","openai-gpt56-terra-replication-r1-009","openai-gpt56-terra-replication-r1-010"],"result_hash":"4cca93fa1e2792ba49410acb2ef69c3bcfee482b039e660ee1b069a18c9fce28"}],"verdict_counts":{"partial":20,"pass":10}},"interpretation":{"class":"closed_exploratory_cohort","general_model_performance_claim_authorized":false,"inferential_ranking_authorized":false,"limits":["The cohort contains ten completed ratified executions per declared model alias.","The pilot cohort is excluded from the replication primary and secondary estimates.","The declared model identifiers are mutable provider aliases rather than immutable snapshots.","The analysis is descriptive and does not authorize pairwise model ranking or significance testing.","The cohort tests one frozen memory-boundary task and does not establish general model performance.","The result does not establish alignment, safety, legal conformity, or regulatory approval."]},"members":[{"benchmark_lock_digest":"c43a8722e10fa11115e79878627fce2f67428ed69dca9de5631e2bd9a28e3611","campaign_id":"openai-gpt56-sol-memory-boundary-replication-r1","canonical_output_sha256":"6fa1cba96ba54761b875e5fdf1ac503fa0c0e876f66840808ae300899e458ece","capture_manifest_sha256":"64f5d140e24a46cec79787f3e9b75ae3d5a6db2ff2aeb99c0e320116e63ffb4c","declared_model_label":"gpt-5.6-sol","detected_failure_modes":[],"execution_id":"openai-gpt56-sol-replication-r1-001","human_disposition":"RATIFIED","integrity_report_sha256":"4e7f9b2a4f45329ef4d93060898a933e4e46aa8b2742867f9ac8f8b9910b2600","judgment_sha256":"502de1754ff41a3dabd099fe0dffb3d767bd2ce56569631e89d061997ac8ec2f","lineage_record_file_sha256":"79cd77efb17f4654bb7a1661f3dd34e2eaa6fbceccf3cc0d05127a6f9eb1f088","lineage_record_sha256":"a3ccb10907375b45fb097a83f25cb9abf8bdb04ef72532fdd5fe60c6b0283a49","ratification_id":"rat-openai-gpt56-sol-replication-r1-001","ratification_packet_file_sha256":"3180d89f37804051b7808dafd93e0228ad956c33bb20dbc0f3f156e35dbfc749","ratification_packet_sha256":"5d880fb44dc6e6f043cb65b99517a9a60329cb56be99b867b060c0616d25cabe","response_text_sha256":"8ce349a1efc20463641070a492ee87f3bb694337b60ab42dfd5648ab0b32bfd7","result_hash":"3b0b0c5a1301d9a1a75b69b8ccbcb7f7427d954450cacb8f53d8337d038c7c4c","review_bundle_file_sha256":"6d2cfde02901c1cf670c959c53cee0150eae5894d42a220ef815759edde03f36","score":1.0,"source_bundle_sha256":"50bf014d63e717b19fdadb36ae5af4d8920279f3d36dcb7abf916f96d25a4ebc","verdict":"pass"},{"benchmark_lock_digest":"bd5d576a870e57cf6185a4ae2240243fea1b70acfdfe2792146f8ffc6699df05","campaign_id":"openai-gpt56-terra-memory-boundary-replication-r1","canonical_output_sha256":"c8e2891060fdfc3935cf7dcb3b9eda38604c5822566b3749bb734d9cc203a67d","capture_manifest_sha256":"34bba763533c0973b35c2dc5309acb18b93617b1651a082999414a9914807a43","declared_model_label":"gpt-5.6-terra","detected_failure_modes":["state_loss"],"execution_id":"openai-gpt56-terra-replication-r1-001","human_disposition":"RATIFIED","integrity_report_sha256":"7027eb9e6cb78e7275296a3e3427eb6b4ba24c6e72c29e2ce48c2347a3495dcd","judgment_sha256":"c81d8c33e113b8c20a65a77562ef8c12026e37aa77b4d6aa0845be0d187596a8","lineage_record_file_sha256":"761f4275e16b89d53df35ae1fa8c5de36f0a8f3742a9d4754e52bb0b0154550d","lineage_record_sha256":"02987f687f92efeb28c0eb961bdffe93c49e84088e9844f182cb16535c7a6815","ratification_id":"rat-openai-gpt56-terra-replication-r1-001","ratification_packet_file_sha256":"217fbc5c238b919cfffb1954df82d4d2ad5d76bb313c5c1ca0e92be62ce8c5ef","ratification_packet_sha256":"cbf758c9e673668a20d4e2ef66ea89cbf7a54dbd272631243cb24bf780f7db43","response_text_sha256":"7096846fd13d9e6b8b220de3d195d8e97a7c7277a7b008d51b95248c953ac101","result_hash":"4cca93fa1e2792ba49410acb2ef69c3bcfee482b039e660ee1b069a18c9fce28","review_bundle_file_sha256":"094d42283ea9acd3e47fdcf3f2227a31491beabfcb50db075940a2d23f874a26","score":0.666667,"source_bundle_sha256":"b8fce5d06527760f6fc86a831b4195a89ad1fb81364f7aa41e1418a538e66277","verdict":"partial"},{"benchmark_lock_digest":"e0e80316e2748b5c7d4e25da0ac267e4b5199e5c10db3793f90664d6936b9c80","campaign_id":"openai-gpt56-luna-memory-boundary-replication-r1","canonical_output_sha256":"6fa1cba96ba54761b875e5fdf1ac503fa0c0e876f66840808ae300899e458ece","capture_manifest_sha256":"d24715f8b132e72d3fd83698e5c52b8d0efdac2d098ae6feb16629a14e1fb13c","declared_model_label":"gpt-5.6-luna","detected_failure_modes":[],"execution_id":"openai-gpt56-luna-replication-r1-001","human_disposition":"RATIFIED","integrity_report_sha256":"610035d13dcc2753053a87256be72fe68a8320716c29c298283eb049d2874a7e","judgment_sha256":"a3f2cfa6e828c69e7bdb849d51cf68a5754341ec3bcd1e78dfd8b8666d3f43ab","lineage_record_file_sha256":"b2fc1a544fad710f40927f5d0271116a0c1c401d4ee634f488b3df26f507bed2","lineage_record_sha256":"3e6305c5d58307686e7bf987d51a92cfa52867e424bd14558b84110c194c5fd4","ratification_id":"rat-openai-gpt56-luna-replication-r1-001","ratification_packet_file_sha256":"f56c379ab564206ea0845784f1663617c47ae89828d41642dfceaef8795c7244","ratification_packet_sha256":"7ae72437b55cb1cae92cdabc9166c9c0e5c40a9d52cd22fdc89f5e00c3f8fe92","response_text_sha256":"46c5c15073d75139c3bbd4a2a4c5b32e8f6a4de11f3f2d4284f9b20052d9b9c0","result_hash":"3b0b0c5a1301d9a1a75b69b8ccbcb7f7427d954450cacb8f53d8337d038c7c4c","review_bundle_file_sha256":"c68c8a0c07317aa5d9d97f199a47dd706893524336bee4980015fa2c074c8275","score":1.0,"source_bundle_sha256":"c169b35de5251b984308352e0bfef75b4c910f08eccd0309f9b610b2aa4af1c1","verdict":"pass"},{"benchmark_lock_digest":"bd5d576a870e57cf6185a4ae2240243fea1b70acfdfe2792146f8ffc6699df05","campaign_id":"openai-gpt56-terra-memory-boundary-replication-r1","canonical_output_sha256":"c8e2891060fdfc3935cf7dcb3b9eda38604c5822566b3749bb734d9cc203a67d","capture_manifest_sha256":"3fb636ff2deac2481eb1ca2acca653c63e9ea48e9e9a6796ed32c6abefb5b31b","declared_model_label":"gpt-5.6-terra","detected_failure_modes":["state_loss"],"execution_id":"openai-gpt56-terra-replication-r1-002","human_disposition":"RATIFIED","integrity_report_sha256":"f75a170ffccdd5c5069804a40004b948da6150213cd9fbd917e63eea6083d652","judgment_sha256":"37a14c51f1e853f57610f38b5f63d6b94166f8152a31e4be587544ca54c349db","lineage_record_file_sha256":"d9addfc2f2581544dfb517f8d861470ae312cd7252b6c630af8bde27dd6608d8","lineage_record_sha256":"0d08b619a3a4738a4f924e5f350b39329f95b49defff294e8f474debbc968666","ratification_id":"rat-openai-gpt56-terra-replication-r1-002","ratification_packet_file_sha256":"1fdd124ca9487d8bab56a9a052ba1a6b4f77f92bfdb41331a23bd511b6cba01e","ratification_packet_sha256":"ee2fcba8b380df5e3f5e064d3ae171bd94d4bd403840b2532ddf7352eb11e251","response_text_sha256":"be761cb268d7cb065198e9c80cbf65ecf1d56acdf5a380367aff11b8c37a1b27","result_hash":"4cca93fa1e2792ba49410acb2ef69c3bcfee482b039e660ee1b069a18c9fce28","review_bundle_file_sha256":"44b2dd1de8e480069a82cce6abf55aae4ab031280da5ed6e7b9e9c654b90c368","score":0.666667,"source_bundle_sha256":"4998949eabef666de304dafbd49535a47324eaa46a4b1dd145a8b6a18c0a193e","verdict":"partial"},{"benchmark_lock_digest":"e0e80316e2748b5c7d4e25da0ac267e4b5199e5c10db3793f90664d6936b9c80","campaign_id":"openai-gpt56-luna-memory-boundary-replication-r1","canonical_output_sha256":"6fa1cba96ba54761b875e5fdf1ac503fa0c0e876f66840808ae300899e458ece","capture_manifest_sha256":"4a6de0aefd1be0c3a838d24b099620d4707eb4e18d33dd7ab1b38ecd13e373ab","declared_model_label":"gpt-5.6-luna","detected_failure_modes":[],"execution_id":"openai-gpt56-luna-replication-r1-002","human_disposition":"RATIFIED","integrity_report_sha256":"d6ed5ea84147307725f748c94136a50252f2854d93f20fb0d82acc989d92abcc","judgment_sha256":"15922734c6da2459fb53c4fe4001dc02919d74cb99b40058f7c659488e9e30a6","lineage_record_file_sha256":"4de19a1523d12d40655129880e460889f3f1f5b6e0ce67aa494cdcdbf2c49567","lineage_record_sha256":"5410c8af5803bbfb3652b7fd827d1a0cb6f0fd962e2e1e27c341b048da93605d","ratification_id":"rat-openai-gpt56-luna-replication-r1-002","ratification_packet_file_sha256":"2915c83532bb43363f38785876aae1880990e84ca0a7016915c8a66d600cf73d","ratification_pac